Symbol,Name,Last Sale,Net Change,% Change,Market Cap,Country,IPO Year,Volume,Sector,Industry
CTLT,Catalent Inc. Common Stock,$41.39,-0.79,-1.873%,7448692949.00,United States,2014,760715,Health Care,Biotechnology: Pharmaceutical Preparations
CTO,CTO Realty Growth Inc. Common Stock,$20.46,0.11,0.541%,384648205.00,United States,1992,65051,Real Estate,Real Estate Investment Trusts
CTO^A,CTO Realty Growth Inc. 6.375% Series A Cumulative Redeemable Preferred Stock,$20.24,0.29,1.454%,,United States,,408,,
CTOS,Custom Truck One Source Inc. Common Stock,$6.88,0.09,1.325%,1696541904.00,Cayman Islands,2017,39709,Consumer Discretionary,Diversified Commercial Services
CTR,ClearBridge MLP and Midstream Total Return Fund Inc. Common Stock,$30.60,0.15,0.493%,214253366.00,United States,2012,6056,Finance,Investment Managers
CTRA,Coterra Energy Inc. Common Stock,$27.61,0.07,0.254%,21769583561.00,United States,,3050890,Energy,Oil & Gas Production
CTRE,CareTrust REIT Inc. Common Stock,$18.97,-0.14,-0.733%,1840635236.00,United States,2022,177760,Real Estate,Real Estate Investment Trusts
CTS,CTS Corporation Common Stock,$42.01,-0.23,-0.545%,1339274095.00,United States,,59677,Technology,Industrial Machinery/Components
CTV,Innovid Corp. Common Stock,$2.78,-0.21,-7.023%,371548610.00,,2021,32567,Consumer Discretionary,Advertising
CTVA,Corteva Inc. Common Stock ,$66.33,0.53,0.805%,47392254360.00,,2019,704285,Industrials,Major Chemicals
CUBB,Customers Bancorp Inc 5.375% Subordinated Notes Due 2034,$20.15,0.16,0.80%,0.00,United States,2019,421,Finance,Major Banks
CUBE,CubeSmart Common Shares,$40.39,-0.31,-0.762%,9070571568.00,United States,,707041,Real Estate,Real Estate Investment Trusts
CUBI,Customers Bancorp Inc Common Stock,$32.21,0.14,0.437%,1047320809.00,United States,,106948,Finance,Major Banks
CUBI^E,Customers Bancorp Inc Fixed-to-Floating Rate Non-Cumulative Perpetual Preferred Stock Series E,$25.57,0.005,0.02%,,United States,,1349,,
CUBI^F,Customers Bancorp Inc Fixed-to-Floating Rate Non-Cumulative Perpetual Preferred Stock Series F,$25.32,0.06,0.238%,,United States,,504,,
CUK,Carnival Plc ADS ADS,$8.78,0.02,0.228%,11406273556.00,United States,,954841,,
CULP,Culp Inc. Common Stock,$5.13,-0.18,-3.39%,62969652.00,United States,,2858,Consumer Discretionary,Textiles
CURO,CURO Group Holdings Corp. Common Stock,$3.17,-0.01,-0.314%,128338658.00,,2017,49432,Finance,Diversified Financial Services
CURV,Torrid Holdings Inc. Common Stock,$3.90,-0.06,-1.515%,404118234.00,,2021,48452,Consumer Discretionary,Clothing/Shoe/Accessory Stores
CUZ,Cousins Properties Incorporated Common Stock,$26.04,0.58,2.278%,3943348677.00,United States,,484458,Real Estate,Real Estate Investment Trusts
CVE,Cenovus Energy Inc Common Stock,$20.11,-0.15,-0.74%,38588817570.00,Canada,,1769294,,
CVEO,Civeo Corporation (Canada) Common Shares,$28.94,0.04,0.138%,396844409.00,,2014,11613,,
CVI,CVR Energy Inc. Common Stock,$40.10,0.19,0.476%,4031277020.00,United States,2007,279722,Energy,Integrated oil Companies
CVII,Churchill Capital Corp VII Class A Common Stock,$9.95,0.01,0.101%,1716375000.00,,2021,54216,Industrials,Consumer Electronics/Appliances
CVNA,Carvana Co. Class A Common Stock,$7.97,-0.15,-1.847%,844403528.00,United States,2017,9203125,Consumer Discretionary,Other Specialty Stores
CVS,CVS Health Corporation Common Stock,$101.26,1.20,1.199%,133052289509.00,United States,,2464847,Health Care,Managed Health Care
CVX,Chevron Corporation Common Stock,$183.70,-0.54,-0.293%,355209400900.00,United States,,2796407,Energy,Integrated oil Companies
CW,Curtiss-Wright Corporation Common Stock,$179.33,1.28,0.719%,6869715178.00,United States,,31444,,
CWAN,Clearwater Analytics Holdings Inc. Class A Common Stock,$18.29,0.23,1.274%,3462480119.00,,2021,209894,Technology,Computer Software: Prepackaged Software
CWEN,Clearway Energy Inc. Class C Common Stock,$36.02,0.15,0.418%,4207294416.00,United States,2015,177670,Utilities,Electric Utilities: Central
CWH,Camping World Holdings Inc. Class A Common Stock,$27.92,-0.13,-0.463%,1176331806.00,United States,2016,174553,Consumer Discretionary,Other Specialty Stores
CWK,Cushman & Wakefield plc Ordinary Shares,$11.35,0.12,1.069%,2562338046.00,,2018,322632,Finance,Real Estate
CWT,California Water Service Group Common Stock,$65.53,0.41,0.63%,3592616720.00,United States,,172211,Utilities,Water Supply
CX,Cemex S.A.B. de C.V. Sponsored ADR,$4.54,-0.03,-0.656%,6577455284.00,Mexico,,1050381,Industrials,Building Materials
CXAC,C5 Acquisition Corporation Class A Common Stock,$10.12,0.0099,0.098%,363687500.00,,2022,702,Industrials,Consumer Electronics/Appliances
CXE,MFS High Income Municipal Trust Common Stock,$3.55,0.01,0.282%,111916494.00,United States,1989,25066,Finance,Investment Managers
CXH,MFS Investment Grade Municipal Trust Common Stock,$7.18,0.00,0.00%,65411559.00,United States,1989,6882,Finance,Investment Managers
CXM,Sprinklr Inc. Class A Common Stock,$8.48,-0.04,-0.469%,2204671486.00,,2021,201354,Technology,Computer Software: Prepackaged Software
CXW,CoreCivic Inc. Common Stock,$12.19,0.04,0.329%,1401620401.00,United States,,327370,Real Estate,Real Estate Investment Trusts
CYD,China Yuchai International Limited Common Stock,$7.09,0.00,0.00%,289683220.00,Singapore,1994,14174,Industrials,Construction/Ag Equipment/Trucks
CYH,Community Health Systems Inc. Common Stock,$3.58,0.19,5.605%,482273181.00,United States,2000,667212,Health Care,Hospital/Nursing Management
CZOO,Cazoo Group Ltd Class A Ordinary Shares,$0.3001,0.0478,18.946%,229040708.00,,,2981703,Consumer Discretionary,Retail-Auto Dealers and Gas Stations
D,Dominion Energy Inc. Common Stock,$61.53,0.50,0.819%,51271423364.00,United States,,1702092,Utilities,Electric Utilities: Central
DAC,Danaos Corporation Common Stock,$57.26,0.13,0.228%,1159495188.00,Greece,2006,41189,Consumer Discretionary,Marine Transportation
DAL,Delta Air Lines Inc. Common Stock,$35.10,0.61,1.769%,22505711506.00,United States,,4352610,Consumer Discretionary,Air Freight/Delivery Services
DAN,Dana Incorporated Common Stock ,$17.79,-0.01,-0.056%,2550258142.00,United States,,255407,Consumer Discretionary,Auto Parts:O.E.M.
DAO,Youdao Inc. American Depositary Shares each representing one Class A Ordinary Share,$3.71,-0.12,-3.133%,459969347.00,,2019,80082,Real Estate,Other Consumer Services
DAR,Darling Ingredients Inc. Common Stock,$73.46,1.20,1.661%,11773538366.00,United States,1997,619086,Consumer Staples,Farming/Seeds/Milling
DASH,DoorDash Inc. Class A Common Stock,$55.47,-1.11,-1.962%,21534416682.00,,2020,1308322,Industrials,Industrial Machinery/Components
DAVA,Endava plc American Depositary Shares (each representing one Class A Ordinary Share),$74.44,-0.19,-0.255%,4225573647.00,United States,2018,53168,Technology,EDP Services
DB,Deutsche Bank AG Common Stock,$10.81,0.16,1.502%,22022132000.00,Germany,,2334955,Finance,Commercial Banks
DBD,Diebold Nixdorf Incorporated Common Stock,$2.29,0.06,2.691%,181088764.00,United States,,525842,Technology,EDP Services
DBI,Designer Brands Inc. Class A Common Stock,$15.34,-0.15,-0.968%,985344360.00,United States,,551744,Consumer Discretionary,Clothing/Shoe/Accessory Stores
DBL,DoubleLine Opportunistic Credit Fund Common Shares of Beneficial Interest,$14.825,0.035,0.237%,232008848.00,United States,2012,6082,,
DBRG,DigitalBridge Group Inc.,$15.37,0.52,3.502%,2457590915.00,United States,2014,613561,Real Estate,Real Estate Investment Trusts
DBRG^H,DigitalBridge Group Inc. 7.125% Series H ,$18.17,0.00,0.00%,,United States,,1036,,
DBRG^I,DigitalBridge Group Inc. 7.15% Series I ,$17.92,0.01,0.056%,,United States,,23366,,
DBRG^J,DigitalBridge Group Inc. 7.125% Series J ,$17.96,-0.01,-0.056%,,United States,,8426,,
DCF,BNY Mellon Alcentra Global Credit Income 2024 Target Term Fund Inc. Common Stock,$7.54,0.01,0.133%,113105482.00,,2017,6382,Finance,Finance/Investors Services
DCI,Donaldson Company Inc. Common Stock,$61.18,0.56,0.924%,7492169180.00,United States,,142404,Industrials,Pollution Control Equipment
DCO,Ducommun Incorporated Common Stock,$51.12,-0.09,-0.176%,618673052.00,United States,,9961,Industrials,Military/Government/Technical
DCP,DCP Midstream  LP Common Units ,$39.00,0.54,1.404%,8127465762.00,United States,,223271,Utilities,Natural Gas Distribution
DCP^B,DCP Midstream LP 7.875% Series B Fixed-to-Floating Rate Cumulative Redeemable Perpetual Preferred Units,$25.00,0.02,0.08%,,United States,,1524,,
DCP^C,DCP Midstream LP 7.95% Series C Fixed-to-Floating Rate Cumulative Redeemable Perpetual Preferred Units,$25.15,0.07,0.279%,,United States,,9242,,
DD,DuPont de Nemours Inc. Common Stock,$71.25,-0.56,-0.78%,35396212545.00,,2017,1051073,Consumer Discretionary,Wholesale Distributors
DDD,3D Systems Corporation Common Stock,$9.74,-0.01,-0.103%,1277515591.00,United States,,327757,Technology,Computer peripheral equipment
DDF,Delaware Investments Dividend & Income Fund Inc. Common Stock,$8.68,0.15,1.758%,66064851.00,United States,1993,19762,Finance,Finance/Investors Services
DDL,Dingdong (Cayman) Limited American Depositary Shares (each two representing three Ordinary Shares),$4.03,-0.19,-4.502%,843748160.00,,2021,228380,Consumer Discretionary,Catalog/Specialty Distribution
DDS,Dillard's Inc. Common Stock,$376.03,2.36,0.632%,6430113000.00,United States,,55123,Consumer Discretionary,Department/Specialty Retail Stores
DDT,Dillard's Capital Trust I,$25.4688,0.0688,0.271%,0.00,United States,,761,Consumer Discretionary,Department/Specialty Retail Stores
DE,Deere & Company Common Stock,$441.47,3.95,0.903%,133244312056.00,United States,,1135508,Industrials,Industrial Machinery/Components
DEA,Easterly Government Properties Inc. Common Stock,$15.84,0.15,0.956%,1438494093.00,United States,2015,267911,Real Estate,Real Estate Investment Trusts
DECK,Deckers Outdoor Corporation Common Stock,$381.18,2.40,0.634%,10088613299.00,United States,1993,107607,Consumer Discretionary,Shoe Manufacturing
DEI,Douglas Emmett Inc. Common Stock,$17.11,0.32,1.906%,3007748165.00,United States,2006,1213007,Real Estate,Real Estate Investment Trusts
DELL,Dell Technologies Inc. Class C Common Stock ,$44.63,0.02,0.045%,32712004041.00,,2018,2034711,Technology,Computer Manufacturing
DEN,Denbury Inc. Common Stock,$89.97,1.13,1.272%,4480516167.00,,2020,384919,Energy,Oil & Gas Production
DEO,Diageo plc Common Stock,$184.11,1.10,0.601%,104690602964.00,United Kingdom,,223879,Consumer Staples,Beverages (Production/Distribution)
DESP,Despegar.com Corp. Ordinary Shares,$5.50,-0.05,-0.901%,364307312.00,,2017,278948,Consumer Discretionary,Other Consumer Services
DEX,Delaware Enhanced Global Dividend Common Shares of Beneficial Interest,$7.6581,0.0581,0.764%,81619302.00,United States,2007,18666,Finance,Finance Companies
DFH,Dream Finders Homes Inc. Class A Common Stock,$9.87,0.21,2.174%,915541328.00,United States,2022,51188,,
DFIN,Donnelley Financial Solutions Inc. Common Stock ,$37.43,0.20,0.537%,1089358902.00,,2016,45409,Finance,Investment Managers
DFP,Flaherty & Crumrine Dynamic Preferred and Income Fund Inc. Common Stock,$19.57,0.02,0.102%,401377491.00,,2013,28119,Finance,Investment Managers
DFS,Discover Financial Services Common Stock,$108.73,0.07,0.064%,29707837428.00,United States,,682605,Finance,Finance: Consumer Services
DG,Dollar General Corporation Common Stock,$257.23,0.90,0.351%,58023815851.00,United States,2009,889040,Consumer Discretionary,Department/Specialty Retail Stores
DGX,Quest Diagnostics Incorporated Common Stock,$149.06,0.60,0.404%,16976065682.00,United States,,459112,Health Care,Medical Specialities
DHF,BNY Mellon High Yield Strategies Fund Common Stock,$2.35,0.01,0.427%,170930855.00,United States,1998,121206,Finance,Finance Companies
DHI,D.R. Horton Inc. Common Stock,$83.89,-0.61,-0.722%,28886785533.00,United States,,953145,,
DHR,Danaher Corporation Common Stock,$267.04,3.69,1.401%,194395159942.00,United States,,868330,Health Care,Medical Specialities
DHR^B,Danaher Corporation 5.00% Mandatory Convertible Preferred Stock Series B,$1357.29,0.00,0.00%,,United States,,90,,
DHT,DHT Holdings Inc.,$10.24,0.10,0.986%,1665570191.00,Jersey,2005,1114759,Consumer Discretionary,Marine Transportation
DHX,DHI Group Inc. Common Stock,$5.66,0.00,0.00%,270438241.00,United States,2007,43883,Consumer Discretionary,Diversified Commercial Services
DIAX,Nuveen Dow 30SM Dynamic Overwrite Fund Common Shares of Beneficial Interest,$15.99,-0.01,-0.063%,581506939.00,,2014,36836,Finance,Finance Companies
DIN,Dine Brands Global Inc. Common Stock,$74.20,1.25,1.714%,1163343290.00,United States,,132887,Consumer Discretionary,Restaurants
DINO,HF Sinclair Corporation Common Stock,$64.79,0.19,0.294%,13005331427.00,United States,1960,977474,Energy,Integrated oil Companies
DIS,Walt Disney Company (The) Common Stock,$98.87,-0.01,-0.01%,176087470000.00,United States,,6664281,Consumer Discretionary,Movies/Entertainment
DK,Delek US Holdings Inc. Common Stock,$33.78,-0.05,-0.148%,2354206434.00,United States,2017,505411,Energy,Integrated oil Companies
DKL,Delek Logistics Partners L.P. Common Units representing Limited Partner Interests,$52.36,-1.24,-2.313%,2277250492.00,United States,2012,26147,Energy,Oil & Gas Production
DKS,Dick's Sporting Goods Inc Common Stock,$121.69,2.71,2.278%,9637720104.00,United States,2002,1121102,Consumer Discretionary,Other Specialty Stores
DLB,Dolby Laboratories Common Stock,$72.07,0.77,1.08%,6915661493.00,United States,2005,198851,Technology,EDP Services
DLNG,Dynagas LNG Partners LP Common Units,$3.06,0.05,1.661%,112614876.00,Greece,,71141,,
DLNG^A,Dynagas LNG Partners LP 9.00% Series A Cumulative Redeemable Preferred Units,$23.8104,0.0604,0.254%,,Greece,,1674,,
DLNG^B,Dynagas LNG Partners LP 8.75% Series B Fixed to Floating Rate Cumulative Redeemable Perpetual Preferred Units liquidation preference $25.00 per Uni,$24.14,-0.35,-1.429%,,Greece,,352,,
DLR,Digital Realty Trust Inc. Common Stock,$111.27,0.28,0.252%,31992603539.00,United States,2004,431762,Real Estate,Real Estate Investment Trusts
DLR^J,Digital Realty Trust Inc. 5.250% Series J Cumulative Redeemable Preferred Stock,$21.46,-0.05,-0.232%,,United States,,7122,,
DLR^K,Digital Realty Trust Inc. 5.850% Series K Cumulative Redeemable Preferred Stock par value $0.01 per share,$23.36,-0.20,-0.849%,,United States,,8882,,
DLR^L,Digital Realty Trust Inc. 5.200% Series L Cumulative Redeemable Preferred Stock,$21.0563,-0.0672,-0.318%,,United States,,16736,,
DLX,Deluxe Corporation Common Stock,$18.83,0.03,0.16%,812252932.00,United States,,84339,Consumer Discretionary,Advertising
DLY,DoubleLine Yield Opportunities Fund Common Shares of Beneficial Interest,$13.48,-0.12,-0.882%,646309101.00,,2020,88449,Finance,Investment Managers
DM,Desktop Metal Inc. Class A Common Stock,$2.04,0.01,0.493%,647857294.00,,2019,1109641,Technology,Computer peripheral equipment
DMA,Destra Multi-Alternative Fund Common Stock,$6.65,-0.08,-1.189%,59605539.00,,2022,2749,Finance,Trusts Except Educational Religious and Charitable
DMB,BNY Mellon Municipal Bond Infrastructure Fund Inc. Common Stock,$11.15,0.03,0.27%,205186860.00,,2013,31338,Finance,Trusts Except Educational Religious and Charitable
DMO,Western Asset Mortgage Opportunity Fund Inc. Common Stock,$11.17,0.01,0.09%,127683097.00,United States,2010,9214,Finance,Trusts Except Educational Religious and Charitable
DMS,Digital Media Solutions Inc. Class A Ordinary Shares,$1.53,-0.1573,-9.323%,61087276.00,United States,2018,87955,Consumer Discretionary,Advertising
DMYS,dMY Technology Group Inc. VI Class A Common Stock,$9.94,0.00,0.00%,300063750.00,,2021,3129,Industrials,Consumer Electronics/Appliances
DNA,Ginkgo Bioworks Holdings Inc. Class A Common Stock,$1.99,0.01,0.505%,3860559931.00,United States,2021,9688797,Health Care,Biotechnology: Biological Products (No Diagnostic Substances)
DNB,Dun & Bradstreet Holdings Inc. Common Stock,$13.48,0.11,0.823%,5873658989.00,United States,2020,745779,Technology,Internet and Information Services
DNMR,Danimer Scientific Inc. Common Stock,$2.79,0.11,4.104%,282874398.00,,2020,318167,Industrials,Plastic Products
DNOW,NOW Inc. Common Stock,$12.44,-0.07,-0.56%,1373870502.00,,2014,128558,Industrials,Metal Fabrications
DNP,DNP Select Income Fund Inc. Common Stock,$11.35,0.01,0.088%,3957291272.00,United States,1987,130961,Finance,Investment Managers
DNZ,D and Z Media Acquisition Corp. Class A Common Stock,$10.02,-0.0073,-0.073%,360093750.00,,2021,44285,Industrials,Consumer Electronics/Appliances
DO,Diamond Offshore Drilling Inc. Common Stock,$9.41,-0.09,-0.947%,953996113.00,United States,2022,363499,Energy,Oil & Gas Production
DOC,Physicians Realty Trust Common Shares of Beneficial Interest,$14.34,0.11,0.773%,3273260732.00,United States,2013,557958,Real Estate,Real Estate Investment Trusts
DOCN,DigitalOcean Holdings Inc. Common Stock,$27.70,-0.47,-1.668%,2667429615.00,United States,2021,391117,Technology,Retail: Computer Software & Peripheral Equipment
DOCS,Doximity Inc. Class A Common Stock,$31.65,-0.74,-2.285%,6092252385.00,,2021,528632,Technology,Retail: Computer Software & Peripheral Equipment
DOLE,Dole plc Ordinary Shares,$10.16,-0.60,-5.576%,964173840.00,,2021,384309,,
DOMA,Doma Holdings Inc. Common Stock,$0.4247,0.007,1.676%,139512227.00,,2021,72157,Finance,Real Estate
DOOR,Masonite International Corporation Ordinary Shares (Canada),$73.69,-0.19,-0.257%,1641521461.00,Canada,,32567,,
DOUG,Douglas Elliman Inc. Common Stock,$4.07,0.10,2.519%,330680023.00,,2021,106454,Real Estate,Building operators
DOV,Dover Corporation Common Stock,$142.99,0.23,0.161%,20069211311.00,United States,,237894,Industrials,Industrial Machinery/Components
DOW,Dow Inc. Common Stock ,$51.56,0.01,0.019%,36285827910.00,,2019,1648145,Industrials,Industrial Specialties
DPG,Duff & Phelps Utility and Infrastructure Fund Inc.,$13.51,0.01,0.074%,514057364.00,United States,2011,33209,Finance,Trusts Except Educational Religious and Charitable
DPZ,Domino's Pizza Inc Common Stock,$389.06,-2.68,-0.684%,13772482394.00,United States,2004,184942,Consumer Discretionary,Food Distributors
DQ,DAQO New Energy Corp. American Depositary Shares each representing five ordinary shares,$49.82,-1.38,-2.695%,3735490846.00,China,2010,723999,Technology,Semiconductors
DRD,DRDGOLD Limited American Depositary Shares,$6.67,-0.15,-2.199%,572270285.00,South Africa,,75534,Basic Materials,Precious Metals
DRH,Diamondrock Hospitality Company Common Stock,$9.07,0.11,1.228%,1899029708.00,United States,2005,423762,Real Estate,Real Estate Investment Trusts
DRH^A,Diamondrock Hospitality Company 8.250% Series A Cumulative Redeemable Preferred Stock,$25.05,0.375,1.52%,,United States,,16432,,
DRI,Darden Restaurants Inc. Common Stock,$148.39,0.06,0.04%,18161015685.00,United States,,335996,Consumer Discretionary,Restaurants
DRQ,Dril-Quip Inc. Common Stock,$23.58,-0.52,-2.158%,799827139.00,United States,1997,92416,Industrials,Metal Fabrications
DS,Drive Shack Inc.,$0.47,0.02,4.444%,43420959.00,United States,,261106,Consumer Discretionary,Movies/Entertainment
DS^B,Drive Shack Inc. Preferred Series B,$11.95,0.78,6.983%,,United States,,207,,
DS^C,Drive Shack Inc. Preferred Series C,$11.03,-0.97,-8.083%,,United States,,245,,
DS^D,Drive Shack Inc. Pfd Ser D,$10.75,-0.24,-2.184%,,United States,,1689,,
DSAQ,Direct Selling Acquisition Corp. Class A Common Stock,$10.17,0.00,0.00%,292387500.00,,2021,20,Industrials,Consumer Electronics/Appliances
DSL,DoubleLine Income Solutions Fund Common Shares of Beneficial Interests,$11.54,0.09,0.786%,1177043395.00,,2013,96406,Finance,Trusts Except Educational Religious and Charitable
DSM,BNY Mellon Strategic Municipal Bond Fund Inc. Common Stock,$5.79,0.02,0.347%,286192121.00,United States,1989,97474,Finance,Investment Managers
DSU,Blackrock Debt Strategies Fund Inc. Common Stock,$9.63,-0.04,-0.414%,448857305.00,United States,1998,44372,Finance,Finance Companies
DSX,Diana Shipping inc. common stock,$3.97,-0.36,-8.314%,342213361.00,Greece,2005,1219267,Consumer Discretionary,Marine Transportation
DSX^B,Diana Shipping Inc. Perpetual Preferred Shares Series B (Marshall Islands),$25.00,-0.14,-0.557%,,Greece,,305,,
DT,Dynatrace Inc. Common Stock,$36.71,-0.17,-0.461%,10567083373.00,United States,2019,490826,Technology,EDP Services
DTB,DTE Energy Company 2020 Series G 4.375% Junior Subordinated Debentures due 2080,$19.06,0.07,0.369%,0.00,United States,2020,5823,Utilities,Electric Utilities: Central
DTC,Solo Brands Inc. Class A Common Stock,$4.23,0.02,0.475%,268991905.00,,2021,54430,Miscellaneous,Diversified Commercial Services
DTE,DTE Energy Company Common Stock,$114.78,0.29,0.253%,22237705727.00,United States,,386971,Utilities,Electric Utilities: Central
DTF,DTF Tax-Free Income 2028 Term Fund Inc. Common Stock,$11.1551,0.0055,0.049%,78415523.00,United States,1991,235,Finance,Investment Managers
DTG,DTE Energy Company 2021 Series E 4.375% Junior Subordinated Debentures,$18.92,-0.05,-0.264%,0.00,United States,2021,5965,Utilities,Electric Utilities: Central
DTLA^,Brookfield DTLA Inc. 7.625% Series A Cumulative Redeemable Preferred Stock,$6.71,0.04,0.60%,,,,638,,
DTM,DT Midstream Inc. Common Stock ,$59.81,0.49,0.826%,5786676293.00,,2021,276218,Utilities,Oil & Gas Production
DTW,DTE Energy Company 2017 Series E 5.25% Junior Subordinated Debentures due 2077,$22.70,0.04,0.177%,0.00,United States,2017,9549,Utilities,Electric Utilities: Central
DUK,Duke Energy Corporation (Holding Company) Common Stock,$99.62,1.08,1.096%,76713653347.00,United States,,1275680,Utilities,Power Generation
DUK^A,Duke Energy Corporation Depositary Shares each representing a 1/1000th interest in a share of 5.75% Series A Cumulative Redeemable Perpetual Preferred Stock,$24.41,0.0107,0.044%,,United States,,19282,,
DUKB,Duke Energy Corporation 5.625% Junior Subordinated Debentures due 2078,$24.44,0.02,0.082%,0.00,United States,2018,7121,Utilities,Power Generation
DV,DoubleVerify Holdings Inc. Common Stock,$25.32,-0.55,-2.126%,4174637203.00,,2021,294954,Technology,Computer Software: Prepackaged Software
DVA,DaVita Inc. Common Stock,$73.92,1.63,2.255%,6660192000.00,United States,,360008,Health Care,Medical/Nursing Services
DVN,Devon Energy Corporation Common Stock,$68.35,0.55,0.811%,44680395000.00,United States,1985,3520469,Energy,Oil & Gas Production
DX,Dynex Capital Inc. Common Stock,$13.05,0.08,0.617%,604869197.00,United States,,460419,Real Estate,Real Estate Investment Trusts
DX^C,Dynex Capital Inc. 6.900% Series C Fixed-to-Floating Rate Cumulative Redeemable Preferred Stock,$21.649,0.0807,0.374%,,United States,,434,,
DXC,DXC Technology Company Common Stock ,$29.68,0.07,0.236%,6828335819.00,,,514644,Technology,EDP Services
DY,Dycom Industries Inc. Common Stock,$91.42,-0.04,-0.044%,2693039481.00,United States,,232601,Industrials,Water Sewer Pipeline Comm & Power Line Construction
E,ENI S.p.A. Common Stock,$29.72,0.36,1.226%,52355432915.00,Italy,,308888,Energy,Oil & Gas Production
EAF,GrafTech International Ltd. Common Stock,$5.36,-0.13,-2.368%,1375361753.00,United States,2018,840115,Consumer Discretionary,Metal Fabrications
EAI,Entergy Arkansas LLC First Mortgage Bonds 4.875% Series Due September 1 2066,$21.56,0.04,0.186%,0.00,United States,2016,8359,,
EARN,Ellington Residential Mortgage REIT Common Shares of Beneficial Interest,$7.31,0.05,0.689%,96823128.00,United States,2013,60352,Real Estate,Real Estate Investment Trusts
EAT,Brinker International Inc. Common Stock,$34.81,0.21,0.607%,1532740971.00,United States,,257003,Consumer Discretionary,Restaurants
EB,Eventbrite Inc. Class A Common Stock,$7.09,-0.09,-1.253%,699713213.00,United States,2018,381745,Technology,EDP Services
EBF,Ennis Inc. Common Stock,$22.86,0.03,0.131%,590619921.00,United States,,82189,Consumer Discretionary,Office Equipment/Supplies/Services
EBR,Centrais Electricas Brasileiras S A American Depositary Shares (Each representing one Common Share),$8.45,0.05,0.595%,19445374716.00,,2016,700887,Utilities,Electric Utilities: Central
EBS,Emergent Biosolutions Inc. Common Stock,$11.90,0.07,0.592%,593669794.00,United States,2006,373282,Health Care,Biotechnology: Pharmaceutical Preparations
EC,Ecopetrol S.A. American Depositary Shares,$10.43,0.18,1.756%,21442356276.00,Colombia,,1306193,Energy,Oil & Gas Production
ECAT,BlackRock ESG Capital Allocation Trust Common Shares of Beneficial Interest,$14.18,0.07,0.496%,1480773839.00,,2021,252051,Finance,Trusts Except Educational Religious and Charitable
ECC           ,Eagle Point Credit Company Inc. Common Stock,$11.08,0.01,0.09%,483998078.00,United States,2014,143881,Finance,Trusts Except Educational Religious and Charitable
ECC^D,Eagle Point Credit Company Inc. 6.75% Series D Preferred Stock,$21.5181,0.00,0.00%,,United States,,112,,
ECCC,Eagle Point Credit Company Inc. 6.50% Series C Term Preferred Stock due 2031,$21.3706,0.0506,0.237%,0.00,United States,,570,Finance,Trusts Except Educational Religious and Charitable
ECCV,Eagle Point Credit Company Inc. 5.375% Notes due 2029,$21.30,-0.0529,-0.248%,0.00,United States,2022,1809,Finance,Trusts Except Educational Religious and Charitable
ECCW,Eagle Point Credit Company Inc. 6.75% Notes due 2031,$22.50,0.00,0.00%,0.00,United States,2021,4,Finance,Trusts Except Educational Religious and Charitable
ECCX,Eagle Point Credit Company Inc. 6.6875% Notes due 2028,$23.6999,0.1199,0.508%,0.00,United States,2022,1651,Finance,Trusts Except Educational Religious and Charitable
ECL,Ecolab Inc. Common Stock,$148.95,-1.11,-0.74%,42425139537.00,United States,,553353,Consumer Discretionary,Package Goods/Cosmetics
ECVT,Ecovyst Inc. Common Stock,$9.10,-0.09,-0.979%,1185303683.00,United States,2017,460569,Industrials,Major Chemicals
ED,Consolidated Edison Inc. Common Stock,$97.50,0.83,0.859%,34599127680.00,United States,,830009,Utilities,Power Generation
