Symbol,Name,Last Sale,Net Change,% Change,Market Cap,Country,IPO Year,Volume,Sector,Industry
IHG,Intercontinental Hotels Group American Depositary Shares (Each representing one Ordinary Share),$58.36,0.41,0.708%,10240254587.00,United Kingdom,,58101,Consumer Discretionary,Hotels/Resorts
IHIT,Invesco High Income 2023 Target Term Fund Common Shares of Beneficial Interest,$8.35,-0.055,-0.654%,201564967.00,United States,2016,45045,Finance,Investment Managers
IHS,IHS Holding Limited Ordinary Shares,$7.20,0.06,0.84%,2388153600.00,,2021,35109,Telecommunications,Telecommunications Equipment
IHTA,Invesco High Income 2024 Target Term Fund Common Shares of Beneficial Interest No par value per share,$8.48,0.09,1.073%,74502414.00,,2017,24121,Finance,Finance/Investors Services
IIF,Morgan Stanley India Investment Fund Inc. Common Stock,$24.135,0.325,1.365%,259375852.00,United States,1994,4479,Finance,Trusts Except Educational Religious and Charitable
IIIN,Insteel Industries Inc. Common Stock,$28.41,0.19,0.673%,553372793.00,United States,,35079,,
IIM,Invesco Value Municipal Income Trust Common Stock,$12.06,0.00,0.00%,567645374.00,United States,,90892,Finance,Investment Managers
IIPR,Innovative Industrial Properties Inc. Common Stock,$118.85,2.17,1.86%,3324584751.00,United States,2016,59783,Real Estate,Real Estate Investment Trusts
IIPR^A,Innovative Industrial Properties Inc. 9.00% Series A Cumulative Redeemable Preferred Stock,$27.62,0.3878,1.424%,,United States,,2258,,
IMAX,Imax Corporation Common Stock,$16.13,0.35,2.218%,902851636.00,Canada,,305852,,
INAQ,Insight Acquisition Corp. Class A Common Stock,$9.975,0.00,0.00%,299250000.00,,2021,100,Industrials,Consumer Electronics/Appliances
INFA,Informatica Inc. Class A Common Stock,$17.34,-0.09,-0.516%,4907967475.00,,2021,75408,Technology,EDP Services
INFY,Infosys Limited American Depositary Shares,$19.92,0.39,1.997%,83824970393.00,India,,3161095,Technology,EDP Services
ING,ING Group N.V. Common Stock,$12.04,0.19,1.603%,43946848266.00,Netherlands,1997,2219073,Finance,Commercial Banks
INGR,Ingredion Incorporated Common Stock,$98.69,0.70,0.714%,6469654235.00,United States,,99900,Consumer Staples,Farming/Seeds/Milling
INN,Summit Hotel Properties Inc. Common Stock,$8.48,0.08,0.952%,906477334.00,United States,2011,148156,Real Estate,Real Estate Investment Trusts
INN^E,Summit Hotel Properties Inc. 6.250% Series E Cumulative Redeemable Preferred Stock,$17.9499,-0.0001,-0.001%,,United States,,1511,,
INN^F,Summit Hotel Properties Inc. 5.875% Series F Cumulative Redeemable Preferred Stock $0.01 par value per share,$17.30,-0.2105,-1.202%,,United States,,417,,
INSI,Insight Select Income Fund,$15.40,0.02,0.13%,164986529.00,United States,,9507,Finance,Investment Managers
INSP,Inspire Medical Systems Inc. Common Stock,$230.28,3.02,1.329%,6653339109.00,United States,2018,73934,Health Care,Biotechnology: Electromedical & Electrotherapeutic Apparatus
INST,Instructure Holdings Inc. Common Stock,$24.04,0.34,1.435%,3425771832.00,,2021,64937,Technology,Computer Software: Prepackaged Software
INSW,International Seaways Inc. Common Stock ,$44.74,1.69,3.926%,2195768421.00,,2016,322164,Consumer Discretionary,Marine Transportation
INT,World Fuel Services Corporation Common Stock,$28.21,0.12,0.427%,1746737134.00,United States,,154302,Energy,Oil Refining/Marketing
INVH,Invitation Homes Inc. Common Stock,$31.72,0.12,0.38%,19393922313.00,United States,2017,1070603,Real Estate,Real Estate Investment Trusts
IONQ,IonQ Inc. Common Stock,$4.91,-0.07,-1.406%,981797752.00,United States,2021,756678,Industrials,Wholesale Distributors
IOT,Samsara Inc. Class A Common Stock,$9.96,0.08,0.81%,5123342029.00,,2021,317688,Technology,Retail: Computer Software & Peripheral Equipment
IP,International Paper Company Common Stock,$36.72,-0.09,-0.244%,13060202730.00,United States,,861797,Industrials,Containers/Packaging
IPG,Interpublic Group of Companies Inc. (The) Common Stock,$34.50,0.28,0.818%,13404102771.00,United States,,1044928,Consumer Discretionary,Advertising
IPI,Intrepid Potash Inc Common Stock,$36.73,0.78,2.17%,495448987.00,United States,2008,100084,Industrials,Major Chemicals
IPVA,InterPrivate II Acquisition Corp. Class A Common Stock,$10.02,0.00,0.00%,326088375.00,,2021,1207,Industrials,Consumer Electronics/Appliances
IPVF,InterPrivate III Financial Partners Inc. Class A Common Stock,$9.96,0.00,0.00%,331033050.00,,2021,13068,Industrials,Consumer Electronics/Appliances
IQI,Invesco Quality Municipal Income Trust Common Stock,$9.90,0.02,0.202%,523549590.00,United States,,26298,Finance,Finance Companies
IQV,IQVIA Holdings Inc. Common Stock,$219.98,2.26,1.038%,40859090260.00,United States,2013,253521,Health Care,Managed Health Care
IR,Ingersoll Rand Inc. Common Stock,$53.42,-0.22,-0.41%,21631133191.00,United States,2017,1213052,Industrials,Industrial Machinery/Components
IRL,New Ireland Fund Inc (The) Common Stock,$9.1875,-0.0125,-0.136%,33322879.00,United States,1990,1792,Finance,Trusts Except Educational Religious and Charitable
IRM,Iron Mountain Incorporated (Delaware)Common Stock REIT,$53.56,0.15,0.281%,15570643822.00,United States,,535371,Real Estate,Real Estate Investment Trusts
IRNT,IronNet Inc. Common Stock,$0.499,-0.0273,-5.187%,51750137.00,United States,2020,743986,Technology,EDP Services
IRRX,Integrated Rail and Resources Acquisition Corp. Class A Common Stock,$10.15,0.00,0.00%,291812500.00,,2022,101068,Industrials,Consumer Electronics/Appliances
IRS,IRSA Inversiones Y Representaciones S.A. Common Stock,$4.02,0.167,4.334%,325977181.00,Argentina,,16425,Real Estate,Homebuilding
IRT,Independence Realty Trust Inc. Common Stock,$17.50,0.11,0.633%,3921302053.00,United States,2013,496350,Real Estate,Real Estate Investment Trusts
ISD,PGIM High Yield Bond Fund Inc.,$12.47,0.01,0.08%,414711348.00,United States,2012,27321,Finance,Trusts Except Educational Religious and Charitable
IT,Gartner Inc. Common Stock,$342.57,-0.70,-0.204%,27071381857.00,United States,1993,337531,Finance,Diversified Commercial Services
ITCB,Itau CorpBanca American Depositary Shares (each representing 1500 shares of Common Stock no par value),$2.96,-0.09,-2.951%,1921075265.00,Chile,,2381,Finance,Commercial Banks
ITGR,Integer Holdings Corporation Common Stock,$72.02,0.59,0.826%,2386094116.00,United States,,85802,Health Care,Medical/Dental Instruments
ITT,ITT Inc. Common Stock ,$84.58,0.44,0.523%,6994766000.00,United States,2011,71988,Industrials,Fluid Controls
ITUB,Itau Unibanco Banco Holding SA American Depositary Shares (Each repstg 500 Preferred shares),$4.86,0.03,0.621%,47632211968.00,Brazil,,22096556,Finance,Major Banks
ITW,Illinois Tool Works Inc. Common Stock,$228.97,0.29,0.127%,70336465200.00,United States,,417318,Industrials,Industrial Machinery/Components
IVC,Invacare Corporation Common Stock,$0.378,-0.012,-3.077%,14271139.00,United States,,128088,Health Care,Industrial Specialties
IVH,Delaware Ivy High Income Opportunities Fund,$10.7801,-0.0049,-0.045%,178628780.00,,2013,19803,Finance,Investment Managers
IVR,INVESCO MORTGAGE CAPITAL INC Common Stock,$13.10,-0.01,-0.076%,465050000.00,United States,2009,750717,Real Estate,Real Estate Investment Trusts
IVR^B,Invesco Mortgage Capital Inc. Preferred Series B Cum Fxd to Fltg,$19.75,-0.25,-1.25%,,United States,,2589,,
IVR^C,INVESCO MORTGAGE CAPITAL INC 7.5% Fixed-to-Floating Series C Cumulative Redeemable Preferred Stock Liquation Preference $25.00 per Share,$20.10,0.07,0.349%,,United States,,4410,,
IVT,InvenTrust Properties Corp. Common Stock,$24.65,-0.30,-1.202%,1662089625.00,,2021,56203,Real Estate,Real Estate Investment Trusts
IVZ,Invesco Ltd Common Stock,$19.41,0.10,0.518%,8827369241.00,United States,,1433433,Finance,Investment Managers
IX,Orix Corp Ads Common Stock,$80.69,2.25,2.868%,19015461157.00,Japan,,15861,Finance,Diversified Financial Services
J,Jacobs Solutions Inc. Common Stock,$123.62,0.92,0.75%,15617195712.00,,2022,227412,Industrials,Oilfield Services/Equipment
JATT,JATT Acquisition Corp Class A Ordinary Shares,$10.15,0.00,0.00%,175087500.00,,2021,1075,Health Care,Biotechnology: Biological Products (No Diagnostic Substances)
JBGS,JBG SMITH Properties Common Shares ,$20.01,0.27,1.368%,2276896559.00,United States,2017,455593,Real Estate,Real Estate Investment Trusts
JBI,Janus International Group Inc. Common Stock,$10.54,0.13,1.249%,1545662279.00,,2021,130509,,
JBK,Lehman ABS 3.50 3.50% Adjustable Corp Backed Tr Certs GS Cap I,$25.71,0.00,0.00%,0.00,United States,,100,Finance,Trusts Except Educational Religious and Charitable
JBL,Jabil Inc. Common Stock,$70.63,0.18,0.256%,9509522270.00,United States,1993,264732,Technology,Electrical Products
JBT,John Bean Technologies Corporation Common Stock,$91.77,0.09,0.098%,2923645184.00,United States,,66197,Industrials,Diversified Manufacture
JCE,Nuveen Core Equity Alpha Fund Nuveen Core Equity Alpha Fund Common Shares of Beneficial Interest,$13.38,0.27,2.059%,214908811.00,United States,2007,32101,Finance,Trusts Except Educational Religious and Charitable
JCI,Johnson Controls International plc Ordinary Share,$66.85,-0.10,-0.149%,45906154980.00,Switzerland,,1430975,Industrials,Industrial Machinery/Components
JEF,Jefferies Financial Group Inc. Common Stock,$38.11,0.44,1.168%,8726812254.00,United States,,243930,Finance,Investment Bankers/Brokers/Service
JELD,JELD-WEN Holding Inc. Common Stock,$9.85,0.02,0.203%,830726906.00,United States,2017,236724,,
JEMD,Nuveen Emerging Markets Debt 2022 Target Term Fund Common Shares of Beneficial Interest $0.01 par value per share,$6.63,-0.0035,-0.053%,94467462.00,,2017,21540,Finance,Investment Managers
JEQ,abrdn Japan Equity Fund Inc. Common Stock,$5.77,0.12,2.124%,77367253.00,United States,1992,7915,Finance,Finance Companies
JFR,Nuveen Floating Rate Income Fund Common Stock,$8.39,-0.03,-0.356%,477545947.00,United States,2004,45859,Finance,Trusts Except Educational Religious and Charitable
JGH,Nuveen Global High Income Fund Common Shares of Beneficial Interest,$11.48,0.02,0.175%,266076472.00,United States,2014,14792,Finance,Investment Managers
JHAA,Nuveen Corporate Income 2023 Target Term Fund,$9.07,0.0191,0.211%,70983108.00,,2018,5703,Finance,Finance/Investors Services
JHG,Janus Henderson Group plc Ordinary Shares,$25.31,0.29,1.159%,4192801576.00,,2017,285783,Finance,Investment Managers
JHI,John Hancock Investors Trust Common Stock,$13.21,0.10,0.763%,115515466.00,United States,,4827,Finance,Trusts Except Educational Religious and Charitable
JHS,John Hancock Income Securities Trust Common Stock,$11.14,0.02,0.18%,129742957.00,United States,,5371,Finance,Finance Companies
JHX,James Hardie Industries plc American Depositary Shares (Ireland),$20.02,0.47,2.404%,8922011538.00,Ireland,,60859,Industrials,Building Materials
JILL,J. Jill Inc. Common Stock,$26.03,0.96,3.829%,264165559.00,,2017,57172,Consumer Discretionary,Clothing/Shoe/Accessory Stores
JKS,JinkoSolar Holding Company Limited American Depositary Shares (each representing 4 Common Shares),$47.81,-0.33,-0.686%,2396404917.00,China,2010,131843,Technology,Semiconductors
JLL,Jones Lang LaSalle Incorporated Common Stock,$164.05,1.53,0.941%,7786233624.00,United States,,75664,Finance,Real Estate
JLS,Nuveen Mortgage and Income Fund,$16.00,0.07,0.439%,87799040.00,United States,2009,4030,Finance,Investment Managers
JMIA,Jumia Technologies AG American Depositary Shares each representing two Ordinary Shares,$4.10,-0.07,-1.679%,409495950.00,,2019,1001182,Consumer Discretionary,Catalog/Specialty Distribution
JMM,Nuveen Multi-Market Income Fund (MA),$5.8515,0.0165,0.283%,55368941.00,United States,,1075,Finance,Trusts Except Educational Religious and Charitable
JNJ,Johnson & Johnson Common Stock,$177.24,0.23,0.13%,463391074505.00,United States,,3058608,Health Care,Biotechnology: Pharmaceutical Preparations
JNPR,Juniper Networks Inc. Common Stock,$32.02,0.29,0.914%,10392267846.00,United States,1999,1287791,Technology,Computer peripheral equipment
JOBY,Joby Aviation Inc. Common Stock,$4.10,0.03,0.737%,2549098650.00,United States,2020,1093243,Consumer Discretionary,Aerospace
JOE,St. Joe Company (The) Common Stock,$36.91,-0.11,-0.297%,2153164818.00,United States,,78055,Real Estate,Homebuilding
JOF,Japan Smaller Capitalization Fund Inc Common Stock,$6.39,0.06,0.948%,181053576.00,United States,1990,31097,Finance,Trusts Except Educational Religious and Charitable
JPC,Nuveen Preferred & Income Opportunities Fund,$7.54,0.01,0.133%,792222009.00,United States,2003,76531,Finance,Investment Managers
JPI,Nuveen Preferred and Income Term Fund Common Shares of Beneficial Interest,$19.18,0.11,0.577%,436774996.00,,2012,29672,Finance,Finance Companies
JPM,JP Morgan Chase & Co. Common Stock,$136.74,0.26,0.191%,401086436385.00,United States,,3220496,Finance,Major Banks
JPM^C,J P Morgan Chase & Co Depositary Shares each representing a 1/400th interest in a share of 6.00% Non-Cumulative  Preferred Stock Series EE,$25.42,-0.12,-0.47%,,United States,,36153,,
JPM^D,J P Morgan Chase & Co Depositary Shares each representing a 1/400th  interest in a share of 5.75% Non-Cumulative  Preferred Stock Series DD,$24.53,-0.03,-0.122%,,United States,,26938,,
JPM^J,J P Morgan Chase & Co Depositary Shares each representing a 1/400th interest in a share of JPMorgan Chase & Co. 4.75% Non-Cumulative Preferred Stock Series GG,$20.62,0.06,0.292%,,United States,,22658,,
JPM^K,J P Morgan Chase & Co Depositary Shares each representing a 1/400th interest in a share of 4.55% Non-Cumulative Preferred Stock Series JJ,$19.51,-0.02,-0.102%,,United States,,40413,,
JPM^L,J P Morgan Chase & Co Depositary Shares each representing a 1/400th interest in a share of 4.625% Non-Cumulative Preferred Stock Series LL,$19.72,0.01,0.051%,,United States,,60793,,
JPM^M,J P Morgan Chase & Co Depositary Shares each representing a 1/400th interest in a share of 4.20% Non-Cumulative Preferred Stock Series MM,$18.46,-0.01,-0.054%,,United States,,84242,,
JPS,Nuveen Preferred & Income Securities Fund,$7.01,-0.03,-0.426%,1442033633.00,United States,2002,242092,Finance,Investment Managers
JPT,Nuveen Preferred and Income Fund Common Shares of Beneficial Interest,$18.02,-0.14,-0.771%,79137064.00,United States,2017,2143,Finance,Trusts Except Educational Religious and Charitable
JQC,Nuveen Credit Strategies Income Fund Shares of Beneficial Interest,$5.16,-0.05,-0.96%,699743936.00,United States,2003,396783,Finance,Finance Companies
JRI,Nuveen Real Asset Income and Growth Fund Common Shares of Beneficial Interest,$12.06,0.05,0.416%,331091381.00,United States,2012,22590,Finance,Finance Companies
JRO,Nuveen Floating Rate Income Opportuntiy Fund Shares of Beneficial Interest,$8.231,-0.039,-0.472%,333694765.00,United States,2004,46602,Finance,Investment Managers
JRS,Nuveen Real Estate Income Fund Common Shares of Beneficial Interest,$8.39,0.07,0.841%,242407832.00,United States,2001,51531,Finance,Finance/Investors Services
JSD,Nuveen Short Duration Credit Opportunities Fund Common Shares of Beneficial Interest,$12.27,-0.05,-0.406%,123750901.00,United States,2011,10911,Finance,Finance Companies
JT,Jianpu Technology Inc. American depositary shares,$1.52,-0.01,-0.654%,32199488.00,,2017,3492,Technology,EDP Services
JUN,Juniper II Corp. Class A Common Stock,$10.14,0.05,0.496%,378982500.00,,2021,306,Industrials,Consumer Electronics/Appliances
JWN,Nordstrom Inc. Common Stock,$22.13,0.44,2.029%,3521590164.00,United States,,3903629,Consumer Discretionary,Clothing/Shoe/Accessory Stores
JWSM,Jaws Mustang Acquisition Corp. Class A Ordinary Shares,$10.025,0.00,0.00%,1296984375.00,,2021,309,Finance,Business Services
JXN,Jackson Financial Inc. Class A Common Stock ,$37.84,0.10,0.265%,3142119096.00,,2021,170686,Finance,Life Insurance
K,Kellogg Company Common Stock,$72.80,0.29,0.40%,24845267356.00,United States,,1045005,Consumer Staples,Packaged Foods
KAHC,KKR Acquisition Holdings I Corp. Class A Common Stock,$10.04,0.00,0.00%,1731900000.00,,2021,258170,Industrials,Consumer Electronics/Appliances
KAI,Kadant Inc Common Stock,$193.32,3.91,2.064%,2254807345.00,United States,1992,24265,Technology,Industrial Machinery/Components
KAMN,Kaman Corporation Common Stock,$20.57,0.17,0.833%,576348670.00,United States,,46262,Industrials,Military/Government/Technical
KAR,KAR Auction Services Inc Common Stock,$13.21,-0.08,-0.602%,1438672619.00,United States,2009,247981,,
KB,KB Financial Group Inc,$37.59,0.13,0.347%,14516465189.00,South Korea,,47470,Finance,Commercial Banks
KBH,KB Home Common Stock,$30.86,-0.05,-0.162%,2641128967.00,United States,1986,235782,,
KBR,KBR Inc. Common Stock,$52.50,0.62,1.195%,7202801498.00,United States,2006,323644,Industrials,Oilfield Services/Equipment
KCGI,Kensington Capital Acquisition Corp. V Class A Ordinary Shares,$10.1684,0.0434,0.429%,350809800.00,,2021,302,Finance,Business Services
KD,Kyndryl Holdings Inc. Common Stock,$11.18,0.16,1.452%,2535512904.00,,2021,1644693,Technology,EDP Services
KEN,Kenon Holdings Ltd. Ordinary Shares,$38.29,0.26,0.684%,2063235054.00,Singapore,2015,2402,Utilities,Electric Utilities: Central
KEP,Korea Electric Power Corporation Common Stock,$7.61,0.10,1.332%,9770693252.00,South Korea,1994,70026,Utilities,Electric Utilities: Central
KEX,Kirby Corporation Common Stock,$70.31,1.26,1.825%,4211569000.00,United States,,259206,Consumer Discretionary,Marine Transportation
KEY,KeyCorp Common Stock,$19.03,0.11,0.581%,17754411355.00,United States,,2839933,Finance,Major Banks
KEY^I,KeyCorp Depositary Shares Each Representing a 1/40th Ownership Interest in a Share of Fixed-to-Floating Rate Perpetual Non-Cumulative Preferred Stock Series E,$25.14,0.06,0.239%,,United States,,22193,,
KEY^J,KeyCorp Depositary Shares each representing a 1/40th ownership interest in a share of Fixed Rate Perpetual Non-Cumulative Preferred Stock Series F,$23.77,0.22,0.934%,,United States,,21654,,
KEY^K,KeyCorp Depositary Shares each representing a 1/40th ownership interest in a share of Fixed Rate Perpetual Non-Cumulative Preferred Stock Series G,$23.46,0.33,1.427%,,United States,,17573,,
KEY^L,KeyCorp Depositary Shares each representing a 1/40th ownership interest in a share of Fixed Rate Perpetual Non-Cumulative Preferred Stock Series H,$24.77,-0.06,-0.242%,,United States,,13043,,
KEYS,Keysight Technologies Inc. Common Stock,$176.62,0.58,0.329%,31526670000.00,United States,2014,413623,Industrials,Industrial Machinery/Components
KF,Korea Fund Inc. (The) New Common Stock,$23.55,0.05,0.213%,117832566.00,United States,,160,Finance,Investment Managers
KFS,Kingsway Financial Services Inc. Common Stock (DE),$7.18,0.13,1.844%,173932743.00,Canada,,517,,
KFY,Korn Ferry Common Stock,$56.16,-0.44,-0.777%,2997814622.00,United States,1999,124876,Consumer Discretionary,Diversified Commercial Services
KGC,Kinross Gold Corporation Common Stock,$4.12,-0.06,-1.435%,5295875925.00,Canada,2001,7598852,,
KIM,Kimco Realty Corporation Common Stock,$22.72,0.09,0.398%,14051430035.00,United States,,1081884,Real Estate,Real Estate Investment Trusts
KIM^L,Kimco Realty Corporation Class L Depositary Shares each of which represents a one-one thousandth fractional interest in a share of 5.125% Class L Cumulative Redeemable Preferred Stock liquidation preference $25000.00 per share,$20.71,-0.01,-0.048%,,United States,,6307,,
KIM^M,Kimco Realty Corporation Class M Depositary Shares each of which represents a one-one thousandth fractional interest in a share of 5.25% Class M Cumulative Redeemable Preferred Stock liquidation preference $25000.00 per share,$21.01,-0.09,-0.427%,,United States,,3638,,
KIND,Nextdoor Holdings Inc. Class A Common Stock,$2.17,0.00,0.00%,801951484.00,United States,,275312,Consumer Discretionary,EDP Services
KIO,KKR Income Opportunities Fund Common Shares,$11.51,0.05,0.436%,257137026.00,,2013,28390,Finance,Investment Managers
KKR,KKR & Co. Inc. Common Stock,$51.85,-0.23,-0.442%,44648650097.00,United States,,783368,Finance,Investment Managers
KKR^C,KKR & Co. Inc. 6.00% Series C Mandatory Convertible Preferred Stock,$64.05,-0.07,-0.109%,,United States,,2911,,
KKRS,KKR Group Finance Co. IX LLC 4.625% Subordinated Notes due 2061,$18.11,0.05,0.277%,0.00,,2021,9871,,
KLR,Kaleyra Inc. Common Stock,$1.46,0.07,5.036%,65746067.00,United States,2018,167143,Technology,Retail: Computer Software & Peripheral Equipment
KMB,Kimberly-Clark Corporation Common Stock,$135.03,1.03,0.769%,45571557453.00,United States,,540494,Consumer Discretionary,Paper
KMF,Kayne Anderson NextGen Energy & Infrastructure Inc.,$7.98,0.06,0.758%,376635747.00,,2010,32028,Finance,Investment Managers
KMI,Kinder Morgan Inc. Common Stock,$18.63,-0.02,-0.107%,41875434783.00,United States,2011,5981404,Utilities,Natural Gas Distribution
KMPB,Kemper Corporation 5.875% Fixed-Rate Reset Junior Subordinated Debentures due 2062,$19.41,0.03,0.155%,0.00,United States,2022,2810,Finance,Life Insurance
KMPR,Kemper Corporation,$54.28,0.69,1.288%,3467685508.00,United States,,60124,Finance,Property-Casualty Insurers
KMT,Kennametal Inc. Common Stock,$26.80,0.17,0.638%,2159447172.00,United States,,175837,Industrials,Industrial Machinery/Components
KMX,CarMax Inc,$66.76,0.17,0.255%,10549114179.00,United States,,567973,Consumer Discretionary,Other Specialty Stores
KN,Knowles Corporation Common Stock,$15.09,0.04,0.266%,1372381885.00,,2014,152193,Telecommunications,Telecommunications Equipment
KNOP,KNOT Offshore Partners LP Common Units representing Limited Partner Interests,$14.07,0.08,0.572%,477830510.00,United Kingdom,2013,95414,Consumer Discretionary,Marine Transportation
KNSL,Kinsale Capital Group Inc. Common Stock,$311.13,6.72,2.208%,7180953516.00,United States,,59280,Finance,Property-Casualty Insurers
KNSW,KnightSwan Acquisition Corporation Class A Common Stock,$10.19,0.05,0.493%,292962500.00,,2022,870,Industrials,Consumer Electronics/Appliances
KNTK,Kinetik Holdings Inc. Class A Common Stock,$33.03,0.28,0.855%,4458896212.00,United States,2022,112203,Energy,Oil & Gas Production
KNX,Knight-Swift Transportation Holdings Inc.,$54.61,0.60,1.111%,8775608560.00,United States,2017,374941,Industrials,Trucking Freight/Courier Services
KO,Coca-Cola Company (The) Common Stock,$62.69,0.06,0.096%,271103736520.00,United States,,5165499,Consumer Staples,Beverages (Production/Distribution)
KODK,Eastman Kodak Company Common New,$4.33,-0.03,-0.688%,342510690.00,United States,,167527,Consumer Discretionary,Business Services
KOF,Coca Cola Femsa S.A.B. de C.V.  American Depositary Shares each representing 10 Units (each Unit consists of 3 Series B Shares and 5 Series L Shares),$68.33,-0.05,-0.073%,14354986833.00,Mexico,1993,47243,Consumer Staples,Beverages (Production/Distribution)
KOP,Koppers Holdings Inc. Koppers Holdings Inc. Common Stock,$29.51,-0.08,-0.27%,616700128.00,United States,2006,35895,Industrials,Industrial Specialties
KORE,KORE Group Holdings Inc. Common Stock,$2.40,-0.09,-3.614%,183095378.00,,,50475,Consumer Discretionary,Telecommunications Equipment
KOS,Kosmos Energy Ltd. Common Shares (DE),$6.41,0.00,0.00%,2922277341.00,Bermuda,2011,1710046,Energy,Oil & Gas Production
KR,Kroger Company (The) Common Stock,$49.04,1.20,2.508%,35103141884.00,United States,,2438770,Consumer Staples,Food Chains
KRC,Kilroy Realty Corporation Common Stock,$42.58,1.31,3.174%,4976641949.00,United States,1997,300154,Real Estate,Real Estate Investment Trusts
KREF,KKR Real Estate Finance Trust Inc. Common Stock,$16.56,0.05,0.303%,1144213382.00,United States,2017,110323,Real Estate,Real Estate Investment Trusts
KREF^A,KKR Real Estate Finance Trust Inc. 6.50% Series A Cumulative Redeemable Preferred Stock,$17.98,0.44,2.509%,,United States,,62413,,
KRG,Kite Realty Group Trust Common Stock,$22.18,0.15,0.681%,4859613757.00,United States,2004,256035,Real Estate,Real Estate Investment Trusts
KRO,Kronos Worldwide Inc Common Stock,$9.89,-0.01,-0.101%,1141998567.00,United States,,103324,Industrials,Major Chemicals
KRP,Kimbell Royalty Partners Common Units Representing Limited Partner Interests,$17.10,-0.28,-1.611%,1027404902.00,United States,2017,223564,Energy,Oil & Gas Production
KSM,DWS Strategic Municipal Income Trust,$8.21,-0.02,-0.243%,91984356.00,United States,1989,21275,Finance,Trusts Except Educational Religious and Charitable
KSS,Kohl's Corporation Common Stock,$31.93,-0.57,-1.754%,3724251979.00,United States,1992,2513198,Consumer Discretionary,Department/Specialty Retail Stores
KT,KT Corporation Common Stock,$13.94,0.08,0.577%,7138469863.00,South Korea,,267176,Telecommunications,Telecommunications Equipment
KTB,Kontoor Brands Inc. Common Stock ,$44.65,0.57,1.293%,2476540781.00,,2019,195740,,
KTF,DWS Municipal Income Trust,$8.73,0.02,0.23%,344843189.00,United States,1988,46478,Finance,Finance Companies
KTH,Structures Products Cp 8% CorTS Issued by Peco Energy Cap Tr II Preferred Stock,$29.25,0.00,0.00%,0.00,United States,,50,Finance,Investment Managers
KTN,Structured Products Corp 8.205% CorTS 8.205% Corporate Backed Trust Securities (CorTS),$27.56,0.00,0.00%,0.00,United States,,51,,
KUKE,Kuke Music Holding Limited American Depositary Shares each representing one Ordinary Share,$0.6899,0.0199,2.97%,20398446.00,,2021,9133,Real Estate,Other Consumer Services
KW,Kennedy-Wilson Holdings Inc. Common Stock,$16.95,0.45,2.727%,2335553518.00,United States,,272512,Real Estate,Real Estate
KWR,Quaker Houghton Common Stock,$192.39,0.39,0.203%,3449872837.00,United States,,28236,Industrials,Automotive Aftermarket
KYN,Kayne Anderson Energy Infrastructure Fund Inc.,$8.96,0.04,0.448%,1219738509.00,United States,2004,103351,Finance,Finance/Investors Services
L,Loews Corporation Common Stock,$57.41,0.10,0.174%,13630687055.00,United States,,277939,Finance,Property-Casualty Insurers
LAC,Lithium Americas Corp. Common Shares,$24.54,-1.86,-7.045%,3312900000.00,Canada,,3154933,,
